{
  "jobEnvelopeVersion": "0.1.0",
  "jobId": "job_golden_build_0001",
  "idempotencyKey": "living-room-golden.build.rev_golden_0001",
  "requestHash": "sha256:6bc30b61c8297ddf6ea0366b6a9cf270663166f8ca50277486ca051421be88e5",
  "projectId": "project_golden_living_001",
  "sceneId": "scene_golden_living_001",
  "jobType": "buildScene",
  "baseRevisionId": null,
  "requestedRevisionId": "rev_golden_0001",
  "inputs": {
    "sceneSpecPath": "input/scene-spec.json",
    "sceneSpecHash": "sha256:f8b06cacd2acc5a5a979dedcc3eee8f1a9ba7deef72205041821cc406634977a",
    "expectedManifestPath": "input/expected-scene-manifest.json",
    "expectedManifestHash": "sha256:08ebbd75fff42908b6e54c9fe1d4096b91fb223e2ec4ee5d072f5efc8ba6a628"
  },
  "workerRequirements": {
    "os": "windows",
    "dcc": "3ds_max",
    "renderer": "none"
  },
  "policy": {
    "mode": "batch",
    "timeoutSeconds": 900,
    "retryPolicy": "safe"
  }
}
